6;misc3_p1_intervals_v1;{"Miscelaneous=3, Session=1, Problem=1, Name=Intervals, v1","A very interesting problem in which you will..."}
9;hwrk2_p1_compressing_v5;{"HOMEWORK=2, Session=2, PROBLEM=1,Name=COMPRESSING V5","A compression algorithm using ..."}
9;hwrksol2_p1_compressing_v1;{"HOMEWORKSOLUTION=1, Session=2, PROBLEM=1,Name=COMPRESSING V1","This solution consits ..."}
10;hwrk2_p3_active_robot_v5;{"HOMEWORK=2, SESSION=2, PROBLEM=3, NAME=ACTIVE ROBOT V5"}
10;hwrksol2_p3_active_robot_v1;{"HOMEWORKSOLUTION=1, SESSION=2, PROBLEM=3, NAME=ACTIVE ROBOT V1","The solution for active robot problem v1"}
11;hwrk1_p6_nth_prime_v5;{"HOMEWORK=2,SESSION=1, PROBLEM=6,NAME=NTH_PRIME V5", "NTH_PRIME problem consists on..."}
11;hwrksol1_p6_nth_prime_v1;{"HOMEWORKSOLUTION=1,SESSION=1, PROBLEM=6,NAME=NTH_PRIME V1", "THE solution for NTH_PRIME problem consists on..."}
12;misc5_p1_rand_towers_v1;{"MISCELANEOUS=3, SESSION=5, PROBLEM=1,NAME=RANDOM TOWERS V1", "A recursive generation of a tower..."}
